id,Title,Content,Tags,Creators,Formats,resource_url,resource_publication_date,resource_stars
530,"Are There Health Hazards Coming From the Rollout of 5G?","What is 5G and what do we know about the health effect of 5G?

David O. Carpenter, MD
Director
Institute for Health and the Environment
University at Albany","5G|cancer|EMF (electromagnetic-fields)|glioma|health|mobile-phones|safety","David O. Carpenter (https://www.albany.edu/sph/faculty/david-o-carpenter)","Scientific Paper",https://scholarsarchive.library.albany.edu/cgi/viewcontent.cgi?article=1014&context=campus_conversations,2019-10-30,5.0
570,"Outliers: The Story of Success","In this stunning book, Malcolm Gladwell takes us on an intellectual journey through the world of ""outliers""--the best and the brightest, the most famous and the most successful. He asks the question: what makes high-achievers different?
His answer is that we pay too much attention to what successful people are like, and too little attention to where they are from: that is, their culture, their family, their generation, and the idiosyncratic experiences of their upbringing. Along the way he explains the secrets of software billionaires, what it takes to be a great soccer player, why Asians are good at math, and what made the Beatles the greatest rock band.

Brilliant and entertaining, <em>Outliers</em> is a landmark work that will simultaneously delight and illuminate.",health|mathematics|outliers|performance|sociology|success|talent,"Malcolm Gladwell (https://www.gladwellbooks.com/)",Book,https://www.gladwellbooks.com/titles/malcolm-gladwell/outliers/9780316040341/,2008-11-18,5.0
648,"Chaos: Making a New Science","<em>Chaos: Making a New Science</em> is a debut non-fiction book by James Gleick that initially introduced the principles and early development of the chaos theory to the public. It was a finalist for the National Book Award and the Pulitzer Prize in 1987, and was shortlisted for the Science Book Prize in 1989. The book was published on October 29, 1987 by Viking Books. ",chaos|history-of-science|mathematics|nonlinearity|physics|revolutions|science|sociology-of-science|systems-science,"James Gleick (https://around.com/about-james-gleick/)",Book,https://en.wikipedia.org/wiki/Chaos:_Making_a_New_Science,1987-10-29,4.0
663,"Behave: The Biology of Humans at Our Best and Worst","From the celebrated neurobiologist and primatologist, a landmark, genre-defining examination of human behavior, both good and bad, and an answer to the question: <b>Why do we do the things we do?</b>

Sapolsky's storytelling concept is delightful but it also has a powerful intrinsic logic: he starts by looking at the factors that bear on a person's reaction in the precise moment a behavior occurs, and then hops back in time from there, in stages, ultimately ending up at the deep history of our species and its evolutionary legacy.

And so the first category of explanation is the neurobiological one. A behavior occurs--whether an example of humans at our best, worst, or somewhere in between. What went on in a person's brain a second before the behavior happened? Then Sapolsky pulls out to a slightly larger field of vision, a little earlier in time: What sight, sound, or smell caused the nervous system to produce that behavior? And then, what hormones acted hours to days earlier to change how responsive that individual is to the stimuli that triggered the nervous system? By now he has increased our field of vision so that we are thinking about neurobiology and the sensory world of our environment and endocrinology in trying to explain what happened.

Sapolsky keeps going: How was that behavior influenced by structural changes in the nervous system over the preceding months, by that person's adolescence, childhood, fetal life, and then back to his or her genetic makeup? Finally, he expands the view to encompass factors larger than one individual. How did culture shape that individual's group, what ecological factors millennia old formed that culture? And on and on, back to evolutionary factors millions of years old.

The result is one of the most dazzling tours d'horizon of the science of human behavior ever attempted, a majestic synthesis that harvests cutting-edge research across a range of disciplines to provide a subtle and nuanced perspective on why we ultimately do the things we do...for good and for ill. Sapolsky builds on this understanding to wrestle with some of our deepest and thorniest questions relating to tribalism and xenophobia, hierarchy and competition, morality and free will, and war and peace. Wise, humane, often very funny, <i>Behave</i> is a towering achievement, powerfully humanizing, and downright heroic in its own right.",behavior|biology|endocrinology|genes|humans|interdisciplinarity|neuroscience|psychology|sociology|violence,"Robert Sapolsky (https://profiles.stanford.edu/robert-sapolsky)",Book,https://www.amazon.com/Behave-Biology-Humans-Best-Worst/dp/1594205078,2017-05-02,4.0
665,"Principles of Systems Science (Understanding Complex Systems)","This pioneering text provides a comprehensive introduction to systems structure, function, and modeling as applied in all fields of science and engineering. Systems understanding is increasingly recognized as a key to a more holistic education and greater problem solving skills, and is also reflected in the trend toward interdisciplinary approaches to research on complex phenomena. While the concepts and components of systems science will continue to be distributed throughout the various disciplines, undergraduate degree programs in systems science are also being developed, including at the authors’ own institutions. However, the subject is approached, systems science as a basis for understanding the components and drivers of phenomena at all scales should be viewed with the same importance as a traditional liberal arts education.

<i>Principles</i> <i>of Systems Science</i> contains many graphs, illustrations, side bars, examples, and problems to enhance understanding. From basic principles of organization, complexity, abstract representations, and behavior (dynamics) to deeper aspects such as the relations between information, knowledge, computation, and system control, to higher order aspects such as auto-organization, emergence and evolution, the book provides an integrated perspective on the comprehensive nature of systems. It ends with practical aspects such as systems analysis, computer modeling, and systems engineering that demonstrate how the knowledge of systems can be used to solve problems in the real world. Each chapter is broken into parts beginning with qualitative descriptions that stand alone for students who have taken intermediate algebra. The second part presents quantitative descriptions that are based on pre-calculus and advanced algebra, providing a more formal treatment for students who have the necessary mathematical background. Numerous examples of systems from every realm of life, including the physical and biological sciences, humanities, social sciences, engineering, pre-med and pre-law, are based on the fundamental systems concepts of boundaries, components as subsystems, processes as flows of materials, energy, and messages, work accomplished, functions performed, hierarchical structures, and more. Understanding these basics enables further understanding both of how systems endure and how they may become increasingly complex and exhibit new properties or characteristics.
<ul>
 	<li class=""active"">Serves as a textbook for teaching systems fundamentals in any discipline or for use in an introductory course in systems science degree programs</li>
 	<li>Addresses a wide range of audiences with different levels of mathematical sophistication</li>
 	<li>Includes open-ended questions in special boxes intended to stimulate integrated thinking and class discussion</li>
 	<li>Describes numerous examples of systems in science and society</li>
 	<li>Captures the trend towards interdisciplinary research and problem solving</li>
</ul>",behavior|biology|complexity|computers|emergence|engineering|epistemology|evolution|feedback|information|interdisciplinarity|life|mathematics|natural-selection|neuroscience|physics|science|self-organization|sociology|systems-science,"George Mobus (https://faculty.washington.edu/gmobus/)|Michael C. Kalton (https://faculty.washington.edu/mkalton/MCKbio.htm)",Book,https://www.springer.com/gp/book/9781493919192,2014-11-30,5.0
667,"Beyond Freedom and Dignity","<div id=""iframeContent"" dir=""auto"">
<div>

In this profound and profoundly controversial work, a landmark of 20th-century thought originally published in 1971, B. F. Skinner makes his definitive statement about humankind and society.

Insisting that the problems of the world today can be solved only by dealing much more effectively with human behavior, Skinner argues that our traditional concepts of freedom and dignity must be sharply revised. They have played an important historical role in our struggle against many kinds of tyranny, he acknowledges, but they are now responsible for the futile defense of a presumed free and autonomous individual; they are perpetuating our use of punishment and blocking the development of more effective cultural practices. Basing his arguments on the massive results of the experimental analysis of behavior he pioneered, Skinner rejects traditional explanations of behavior in terms of states of mind, feelings, and other mental attributes in favor of explanations to be sought in the interaction between genetic endowment and personal history. He argues that instead of promoting freedom and dignity as personal attributes, we should direct our attention to the physical and social environments in which people live. It is the environment rather than humankind itself that must be changed if the traditional goals of the struggle for freedom and dignity are to be reached.

<i>Beyond Freedom and Dignity</i> urges us to reexamine the ideals we have taken for granted and to consider the possibility of a radically behaviorist approach to human problems--one that has appeared to some incompatible with those ideals, but which envisions the building of a world in which humankind can attain its greatest possible achievements.

</div>
</div>",behavior|culture|freedom|psychology|punishment|sociology,"B. F. Skinner (https://en.wikipedia.org/wiki/B._F._Skinner)",Book,https://www.amazon.com/Beyond-Freedom-Dignity-Hackett-Classics/dp/0872206270,,4.0
669,"Bodily Changes in Pain, Hunger, Fear and Rage: An Account of Recent Researches Into the Function of Emotional Excitement","Cannon is best known for his work on the “Fight or Flight” response. In 1915, he coined the term “fight or flight” to describe an animal's response to threats in “Bodily Changes in Pain, Hunger, Fear and Rage: An Account of Recent Researches into the Function of Emotional Excitement.” He is also credited with being one of the first to understand the significance of “Homeostasis” in the self-regulation of each human being. He developed the concept of “Homeostasis” from the earlier idea of Claude Bernard of milieu interieur, and popularized it in his book “The Wisdom of the Body” in 1932. Cannon presented four tentative propositions to describe the general features of homeostasis:

Constancy in an open system, such as our bodies represent, requires mechanisms that act to maintain this constancy. Cannon based this proposition on insights into the ways by which steady states such as glucose concentrations, body temperature and acid-base balance were regulated.

Steady-state conditions require that any tendency toward change automatically meets with factors that resist change. An increase in blood sugar results in thirst as the body attempts to dilute the concentration of sugar in the extracellular fluid.

The regulating system that determines the homeostatic state consists of a number of cooperating mechanisms acting simultaneously or successively. Blood sugar is regulated by insulin and other hormones that control its release from the liver or its uptake by the tissues.

Homeostasis does not occur by chance, but is the result of organized self-government.",biology|emotions|fear|homeostasis|hunger|pain|physiology|psychology|rage|systems-science,"Walter Bradford Cannon (https://en.wikipedia.org/wiki/Walter_Bradford_Cannon)",Book,https://www.amazon.com/Bodily-Changes-Pain-Hunger-Fear/dp/1684220483,,4.0
671,"The Engineers and the Price System","Veblen proposed a soviet of engineers in one chapter in ""The Engineers and the Price System."" Veblen believed that engineers, not workers, would overthrow capitalism. He had a penchant for socialism and believed that technological developments would eventually lead toward a socialistic organization of economic affairs. However, his views on socialism and the nature of the evolutionary process of economics differed sharply from that of Karl Marx; while Marx saw socialism as the ultimate goal for civilization and saw the working class as the group that would establish it, Veblen saw socialism as one intermediate phase in an ongoing evolutionary process in society that would be brought about by the natural decay of the business enterprise system and by the inventiveness of engineers. A classic work.",capitalism|economics|engineering|governance|planned-obsolescence|scarcity|social-change|socialism|sociology|technocracy|technology,"Thorstein Veblen (https://en.wikipedia.org/wiki/Thorstein_Veblen)",Book,https://en.wikipedia.org/wiki/The_Engineers_and_the_Price_System,,4.0
673,"Designing the Future","A Future by Design

Are you prepared to design the future?

Although many of us feel we can prepare for our future by thinking, acting, and learning using present methods and values, nothing is farther from the truth – especially in today’s rapidly changing world. A newborn child enters a world not of his or her own making. Each succeeding generation inherits the values, accomplishments, hopes, successes, and failings of previous generations. And they inherit the results of the decisions made by those generations.

For the hundreds of thousands of years of human existence when technologies were simple or non-existent, this may have had little impact on human life and the earth that sustains it. Each generation of hunters and gatherers, then plowmen and pioneers, passed on tools to the next generation to help them survive. Change from one generation to the next was slow and hardly noticeable. In those days there was little understanding of science and how things worked, and explanations were not scientific.

This is no longer the case in today’s high-tech world where a change that affects millions may happen in a matter of seconds. A child born today inherits a world vastly different from that of its parent’s generation, let alone that from centuries ago. Previous generations left a legacy of, exploitation, occupation, and irrelevant values that present great challenges, but also opportunities to the people of today.

The application of scientific principles, for better or worse, accounts for every single advance that has improved people’s lives. Important documents and proclamations have been issued granting rights and privileges to members of societies, but at the heart of human progress – or destruction – is the rock-solid foundation of science.

For generations past it was impossible to direct the future much beyond the present moment, and forecasts of the future were based on non- scientific methods. Prophets and sages presented visions of the future based on dreams, hallucinations, religious fervor, divination of animal parts, crystal balls, etc. Some may even have been accurate, but this was more because of luck than because of any direct channel to the supernatural.

Now satellites circle the globe beaming down information in fractions of a second about everything that impacts our lives. This information is very valuable for projecting weather patterns, high and low points, geological hot and cold spots, where people live, and the warming of the planet. This has given us, for the first time, the ability to monitor the health of the planet, which many scientists see as in serious, if not critical, condition.

In a single day, trillions of bits of scientific data zip through cyberspace at light-speed, making a high-tech civilization possible. While physical science and technology silently direct much of the action, millions of people around the globe still practice pseudo-science, using fortune- tellers, seers, and philosophers for their daily direction. Many world leaders regularly consult psychics, mediums, and astrologers for guidance in decisions that determine the fate of millions.

Present human activity and its consequences does not have to be shaped by the needs and values of our ancestors. In fact, it must not be. For instance, armed conflict between nations is still seen by many as the only way to settle differences. It is especially promoted by those who profit handsomely from the sale of armaments. This is now totally unacceptable and dangerous because of war’s extreme human and environmental costs.

A militant viewpoint is obsolete once we view the world as a whole interrelated system with all its people as one family. Managing accelerating changes in technology and managing ourselves require new outlooks and approaches. This is now both necessary and possible because of technological change.

These lessons are designed to challenge the reader to direct the future; not just one’s own, but that of society",abundance|change|computers|design|engineering|futurism|science|social-change|sociology|technology|values,"Jacque Fresco (https://en.wikipedia.org/wiki/Jacque_Fresco)",Book,https://www.thevenusproject.com/learn-more/free-e-books/,,5.0
675,"Cradle to Cradle: Remaking the Way We Make Things","In <i>Cradle to Cradle: Remaking the Way We Make Things</i>, architect William McDonough and chemist Michael Braungart present an integration of design and science that provides enduring benefits for society from safe materials, water and energy in circular economies and eliminates the concept of waste.
<p class=""p3"">The book puts forward a design framework characterized by three principles derived from nature:</p>

<div class=""content-column three_fourth last_column"">
<p class=""p5""><b>Everything is a resource for something else. </b>In nature, the “waste” of one system becomes food for another. Everything can be designed to be disassembled and safely returned to the soil as <span class=""s2"">biological nutrients</span>, or re-utilized as high quality materials for new products as <span class=""s3"">technical nutrients </span>without contamination.</p>
<p class=""p5""><b>Use clean and renewable energy. </b>Living things thrive on the energy of current solar income. Similarly, human constructs can utilize clean and renewable energy in many forms—such as solar, wind, geothermal, gravitational energy and other energy systems being developed today—thereby capitalizing on these abundant resources while supporting human and environmental health.</p>
<p class=""p5""><b>Celebrate diversity. </b>Around the world, geology, hydrology, photosynthesis and nutrient cycling, adapted to locale, yield an astonishing diversity of natural and cultural life. Designs that respond to the challenges and opportunities offered by each place fit elegantly and effectively into their own niches.</p>

</div>
<div class=""clear_column""></div>
<p class=""p3"">Rather than seeking to minimize the harm we inflict,<i> Cradle to Cradle </i>reframes design as a positive, regenerative force—one that creates footprints to delight in, not lament. This paradigm shift reveals opportunities to improve quality, increase value and spur innovation. It inspires us to constantly seek improvement in our designs, and to share our discoveries with others.</p>",abundance|architecture|chemistry|circularity|construction|design|ecology|energy|health|materials|safety|sustainability|technology|waste|water,"Michael Braungart (http://braungart.epea-hamburg.org/en/content/about-michael-braungart)|William McDonough (https://mcdonough.com/)",Book,https://mcdonough.com/writings/cradle-cradle-remaking-way-make-things/,2002-04-22,5.0
677,"Forced Movements, Tropisms, and Animal Conduct",,behavior|biology|instincts|physiology|psychology|tropisms,"Jacques Loeb (https://en.wikipedia.org/wiki/Jacques_Loeb)",Book,https://books.google.com/books/about/Forced_Movements_Tropisms_and_Animal_Con.html?id=4zTpGgddSbUC&redir_esc=y,,4.0
679,"From Freedom to Slavery: The Rebirth of Tyranny in America","Never afraid to take on tough cases or tackle difficult issues, here in From Freedom to Slavery Gerry Spence comes at us uncensored, with his passions on fire. In this underground bestseller, which has come to define Spence's political philosophy, he speaks out against the destructive forces in America today - forces of government and corporate tyranny that are robbing us of our freedom - and he warns us that time is running out. In a dramatic new chapter, presented for the first time in a trade paperback edition, Spence recounts in astonishing detail the government shoot-out at Ruby Ridge and the resulting trial of separatist Randy Weaver, revealing the important lessons we must learn from this tragic case. Finally, Spence makes the eloquent case that we, as Americans, have delivered our freedoms to new masters: corporate and governmental conglomerates, our biased court system, and the censored media. From Freedom to Slavery is an urgent work that urges us to resist this tyranny, a book that must be read and discussed by all concerned citizens of our troubled land.",companies|crime|freedom|governments|human-rights|laws|politics,"Gerry Spence (https://gerryspence.com/)",Book,https://www.amazon.com/Freedom-Slavery-Rebirth-Tyranny-America/dp/0312143427,1996-04-15,4.0
681,"Language in Thought and Action","Renowned professor and former U.S. Senator S. I. Hayakawa discusses the role of language in human life, the many functions of language, and how language - sometimes without our knowing - shapes our thinking in this engaging and highly respected book. Provocative and erudite, it examines the relationship between language and racial and religious prejudice; the nature and dangers of advertising from a linguistic point of view; and, in an additional chapter called The Empty Eye, the content, form, and hidden message of television, from situation comedies to news coverage to political advertising.",communication|emotions|general-semantics|languages|linguistics|philosophy|psychology|relationships|science|thinking,"S. I. Hayakawa (https://en.wikipedia.org/wiki/S._I._Hayakawa)",Book,https://www.amazon.com/Language-Thought-Action-S-I-Hayakawa/dp/0156482401,2020-05-08,5.0
683,"Letters From The Earth","Miscellany of fiction, essays, and notes by Mark Twain, published posthumously in 1962. Written over a period of 40 years, the pieces in the anthology are characterized by a sense of ironic pessimism. The title piece comprises letters written by Satan to his fellow angels about the shameless pride and foolishness of humans. ""Papers of the Adam Family,"" a first-person family history of Adam and Eve, traces the first failed attempts at civilization. Other pieces include ""A Cat-Tale,"" an amusing, alliterative bedtime story; ""Fenimore Cooper's Literary Offenses,"" a critique of that author's style; and ""The Damned Human Race,"" a collection of bitter satirical bits.",atheism|christianity|morality|religion,"Mark Twain (https://en.wikipedia.org/wiki/Mark_Twain)",Book,https://www.amazon.com/dp/B0051RGK74/ref=dp-kindle-redirect?_encoding=UTF8&btkr=1,,4.0
685,"Looking Backward: 2000–1887","First published in 1888, <i>Looking Backward</i> was one of the most popular novels of its day. Translated into more than 20 languages, its utopian fantasy influenced such thinkers as John Dewey, Thorstein Veblen, Eugene V. Debs, and Norman Thomas. Writing from a 19th century perspective and poignantly critical of his own time, Bellamy advanced a remarkable vision of the future, including such daring predictions as the existence of radio, television, motion pictures, credit cards, and covered pedestrian malls.

On the surface, the novel is the story of time-traveler Julian West, a young Bostonian who is put into a hypnotic sleep in the late 19th century, and awakens in the year 2000 in a socialist utopia. In conversations with the doctor who awakened him, he discovers a brilliantly realized vision of an ideal future, one that seemed unthinkable in his own century. Crime, war, personal animosity, and want are nonexistent. Equality of the sexes is a fact of life. In short, a messianic state of brotherly love is in effect.
Entertaining, stimulating, and thought-provoking, <i>Looking Backward,</i> with its ingenious plot and appealing socialism, is a provocative study of human society as it is and as it might be.",futurism|history|science|socialism|sociology|technology,"Edward Bellamy (https://en.wikipedia.org/wiki/Edward_Bellamy)",Book,https://www.amazon.com/dp/B00A62Y5DU/ref=dp-kindle-redirect?_encoding=UTF8&btkr=1,,4.0
